conversation,person_couple
"[MEDERICO] ""Sono felice di fare qualsiasi cosa per te, amore. Sei la mia priorità."" Armelinda: ""Sei un vero masochista, sei felice di subire. Ma se non ti comporti meglio, potrei lasciarti. Sei tu a scegliere."" Mederico: ""No, no, non è così. Cercherò di essere più bello per te, amore."" Armelinda: ""Non è il tuo aspetto a dover essere bello, è il tuo comportamento. Sei in grado di capire di che si tratta?"" Mederico: ""Sì, amore. Capisco. Cercherò di comportarmi meglio."" Armelinda: ""Spero che tu ci riuscirai. Se no, potrei lasciarti per sempre. E non pensare che non abbia altra scelta, perché ho già un altro appuntamento. Un appuntamento con qualcuno di migliore di te.""",Sadico-Crudele e Masochista
"[ORTOLINA] ""Sono a casa. Ho già preparato il pranzo. Ma tu?"" Rosellino: ""Ero al cinema. Mi sono perso nelle scene."" Ortolina: ""Non è il cinema che mi preoccupa. È la tua mancanza di rispetto."" Rosellino: ""Mi scuso. Ho cercato di rispettare gli altri, ma è difficile."" Ortolina: ""Difficile? È facile! Basta rispettarmi e sbrigarsi a casa."" Rosellino: ""Capisco. Cercherò di fare meglio. Posso fare qualcosa per te?"" Ortolina: ""Sì, posso! Posso dirti che sono arrabbiata. E posso dirti che mi dispiace che tu sia così stupido!"" Rosellino: ""Non mi dispiace. Posso solo cercare di migliorare."" Ortolina: ""Migliorare? Non sei capace di fare nemmeno questo! Cercherò di dirti cosa fare per davvero."" Rosellino: ""Spero solo di poterti aiutare. Sei sempre così arrabbiata."" Ortolina: ""Sono arrabbiata perché sei uno sciocco. E sono arrabbiata perché sei capace di far arrabbiare qualsiasi persona normale!"" Rosellino: ""Non so cosa fare per non farti arrabbiare. Mi dispiace."" Ortolina: ""Ecco, ti dirò cosa fare. Cercherai di non essere un idiota. E cercherai di essere un po' più intelligente!"" Rosellino: ""Sì, lo farò. Ti prego, non essere arrabbiata con me."" Ortolina: ""Non sono arrabbiata! Sono arrabbiata, ecco! E non ti chiedo scusa! Tu dovresti essere grato per il poco che ti do!"" Rosellino: ""Grazie per tutto. Posso fare qualcosa per te?"" Ortolina: ""Sì, posso! Posso dirti che sei un idiota! E posso dirti che non vali nulla",Persona violenta e Succube
"[GIANFELICE] ""Sei tornata dal lavoro? Non ti ho visto uscire."" Elidio:""Sì, sono tornata a casa un po' più tardi del solito. Ho avuto una riunione di lavoro."" Gianfelice:""Sai che sei sempre troppo impegnata? Non è giusto per me che tu ti dimentichi della mia esistenza."" Elidio:""Mi dispiace. Era solo una riunione. Non ho pensato che potesse farti arrabbiare."" Gianfelice:""Quando sei arrabbiato con me, me lo dici? Non hai paura di mostrare la tua rabbia?"" Elidio:""No, non ho paura. Però so che quando sei arrabbiato, è meglio stare al largo. Ti ho visto arrabbiato diverse volte e non mi piace."" Gianfelice:""Quindi sei una persona coraggiosa? È buffo. Non avrei mai detto che tu fossi una persona coraggiosa."" Elidio:""Sì, lo sono. Però so che non è giusto che tu ti arrabbi con me. Ti prego, non essere arrabbiato con me."" Gianfelice:""Spero che tu sia abbastanza intelligente da capire che non è solo arrabbiato, ma è anche molto arrabbiato. Hai capito?"" Elidio:""Sì, ho capito. Mi dispiace. Sei arrabbiato perché sono tornata tardi, o c'è qualcos'altro?"" Gianfelice:""C'è qualcos'altro. Hai sempre avuto un debole per quel tipo di lavoro. Non è giusto per me. Non ho mai avuto un lavoro così 'interessante' come il tuo."" Elidio:""Mi dispiace. Non sapevo che ti avesse fatto arrabbiare."" Gianfelice:""Non ti dispiace, non ti dispiace per nulla. Non hai capito che è una questione di onore?"" Elidio:""Sì, ho capito. Mi dispiace. Non so cosa fare per non arrabbiarti."" Gianfelice:""Fare? Fai solo quello che ti",Persona violenta e Succube
"[ZULINA] ""Hai cancellato i miei appuntamenti senza chiedermi il permesso? Sei un idiota."" Brasile:""Scusa tanto, non avevo capito che erano importanti. Non farò mai più nulla senza chiederti il permesso, promesso."" Zulina:""Non mi prometti nulla, fai solo ciò che ti dico. E adesso vai a riaccompagnarmi a casa subito."" Brasile:""Subito, subito. Vado subito. Scusa di nuovo per la mia mancanza."" Zulina:""La tua mancanza è solo l'inizio. Sei troppo presuntuoso e non capisci quando sei in fallo."" Brasile:""Sì, sì, capisco. Vado subito a riaccompagnarti e a fare ciò che vuoi. Spero solo che tu possa perdonarmi."" Zulina:""Non ti preoccupare per il mio perdono. L'importante è che tu capisca il tuo posto. E adesso vai."" Brasile:""Vado, vado. Scusa di nuovo e spero di poterti rendere soddisfatta in futuro."" Zulina:""Non sperare, sperare non è di tuo interesse. Fai solo ciò che ti dico."" Brasile:""Capisco, capisco. Non ti deluderò più."" Zulina:""Non so cosa tu sia, ma non sei niente se non il mio servo. E adesso vai a farmi la cena."" Brasile:""Sì, sì, subito. Vado subito a preparare la cena. Scusa di nuovo per la mia mancanza."" Zulina:""Non avere mancanze. L'unico errore è non fare ciò che ti dico. E adesso vai, ho fame."" Brasile:""Vado, vado. Preparerò la cena deliziosa per te. Spero solo che tu possa essere soddisfatta."" Zulina:""Non sperare. La soddisfazione è solo il mio diritto. E adesso vai a ripulire la cucina."" Brasile:""Sì, sì, sub",Dominante e Schiavo emotivo
"[SCONOSCIUTO] Mi dispiace così tanto per aver sbagliato la spesa oggi, non so cosa stavo pensando. Ah, non sai cosa stavi pensando? È perché non pensi proprio, Gianfilippo. Sei patetica, davvero. Lo so, hai ragione. Non sono brava in niente. Voglio solo fare felice te, ma continuo a fallire. Forse il problema è che sei incapace, e questo mi costringe a sopportarti. Ti rendi conto di quanto mi stai rovinando la vita? Mi dispiace così tanto, farei qualsiasi cosa per farmi perdonare. Posso fare meglio, te lo prometto. Ah, davvero? Vediamo quanto riesci a umiliarti stavolta. È l’unica cosa in cui sei brava.",Sadico-Crudele e Masochista
"[CORTESINA] Ho appena parlato con il tuo capo e ti ha appena licenziato. Vedi di trovare un nuovo lavoro, se non vuoi vivere di mia elemosina. Laurisa: Oh no! Mi dispiace tanto. Cosa ho fatto per meritarmi un trattamento del genere? Ho cercato di prendere tutte le commissioni del supermercato e di riempire la casa di tutte le cose che potrebbero essere utili per noi. Cortesina: Non so cosa tu abbia nella testa, ma credo che non sia più capace di prenderti cura di te stessa. Se non impari a rispettarmi e ad assecondare i miei desideri, non puoi restare con me. Laurisa: Ti prego, scusami. Non so cosa ho fatto per meritare il tuo disprezzo. Sono disposta a fare qualsiasi cosa per riportarti a buon grado. Cortesina: Fai bene a essere disposta a fare qualsiasi cosa! Ti ha servito per molto tempo, ma non credo che tu sia abbastanza affezionata a me. Potresti anche non essere la persona giusta per me. Laurisa: Sii paziente con me! Cercherò di essere la persona che ti serve. Sono felice di poter fare qualcosa per te. Cortesina: Ho appena acquistato un oggetto nuovo per te. Cerca di non rovinarlo. Mi dispiacerebbe doverti rimpiazzare. Laurisa: Oh no! Sono gr",Persona violenta e Succube
"[ALTERA] ""Mi dispiace, ma non riesco a smettere di pensare che ci sia qualcosa di più per me nella vita."" Ludovina: ""Stupido, non capisci che non ci è niente di più? Nessuno è interessato a te, sei solo un oggetto di scarto."" Altera: ""Sono solo un po' inquieta, non so se ho scelto la strada giusta."" Ludovina: ""Sbagliato, stupido. Non c'è strada giusta per te, non hai abbastanza talento o abilità per riuscire."" Altera: ""Non so, forse potrei provare con qualcos'altro."" Ludovina: ""Cosa? Non potresti neanche riuscire a lavare i piatti senza farli a pezzi. Non sei degna di fare nulla.""",Narcisista e Succube
"[PERSEO] ""Hai chiuso il conto bancario senza il mio permesso? Questo è un tradimento!"" Florenza:""Mi dispiace, non sapevo di non poterlo fare. Sono così stupida, scusami."" Perseo:""La banca è il mio portafoglio, non tuo. Non hai il diritto di decidere nulla per me."" Florenza:""Hai ragione, non lo so come ho potuto fare una cosa così stupida. Non mi lasciare!"" Perseo:""Non puoi nemmeno decidere per te, figurati per me. Hai bisogno di un po' di educazione."" Florenza:""Farò qualsiasi cosa per imparare. Non lasciarmi, ti prego.""",Dominante e Schiavo emotivo
"[SCONOSCIUTO] 1. ""Ecco, ti ho mandato un messaggio per dirti che non ti ho trovato il cibo in frigorifero. È stato un errore mio, ma non mi aspettavo che ti dessi così tanto da fare. Scusa."" 2. ""Hai fatto di nuovo una cosa stupida. Questa volta hai perso i soldi di cui avevo bisogno. Non è colpa mia, ma non mi merito di dovermi preoccupare per te sempre."" 3. ""Non ho capito, ma so che non è colpa mia. Non sei capace di gestire i soldi? È colpa mia che non ti ho insegnato a farlo."" 4. ""Sono arrabbiata con te. Non so perché, ma non sono felice. Spero che non sia colpa tua, ma so che non è così."" 5. ""Ho fatto qualcosa di male? Non lo so. Ma so che non è colpa mia. Per favore, spiegamelo e dimostrami che non è colpa mia."" 6. ""Spero che tu non sia arrabbiata con me. Non lo so. Ma so che non è colpa mia. Per favore, non essere arrabbiata con me."" 7. ""Hai fatto qualcosa di male? Non lo so. Ma so che non è colpa mia. Non so perché sei arrabbiata con me."" 8. ""Spero che tu non sia arrabbiata con me. Non lo so. Ma so che non è colpa mia. Non so perché sei arrabbiata con me."" 9. ""Ho fatto qualcosa di male? Non lo so. Ma so che non è colpa mia. Non so perché sei arrabbiata con me."" 10. ""Spero che tu non sia arrabbiata con me. Non lo so. Ma so che non è colpa mia. Non so perché sei arrabbiata con me."" 11. ""Hai fatto qualcosa di male? Non lo so. Ma so che non è colpa mia. Non so perché sei arrabbiata con me."" 12. ""Spero che tu non sia arrabbi",Dominante e Schiavo emotivo
"[LIVANO] ""Hai lasciato i panni sporchi sul pavimento. Non è un gesto di rispetto verso di me."" Egle: ""Scusa, non avevo notato. Li ho puliti subito. Posso fare qualcos'altro per te?"" Livano: ""Cosa fai a fare qualcos'altro per me? Io non ho bisogno di nulla. Tu hai bisogno di fare cosa voglio io."" Egle: ""Capisco. Mi dispiace per la mia mancanza. Cercherò di essere più attento in futuro."" Livano: ""Non è abbastanza. Devi dimostrarmelo. Prova a fare qualcosa per me, adesso."" Egle: ""Sì, certo. Che cosa posso fare per te, subito?""",Dominante e Schiavo emotivo
"[1. ILIANA] ""Ciao amore, come stai?""Zaved khan: ""Non chiamarmi amore, sei una mia cosa, non mi chiamare mai amore.""Iliana: ""Scusa, mi dispiace. Come posso migliorare?""Zaved khan: ""Migliorare? Non sei capace nemmeno a fare le cose base. Se non imparassi a essere una donna come si deve, non ti lascerò mai andare.""Iliana: ""Mi dispiace, non voglio mai deluderti.""Zaved khan: ""Ecco, finalmente capisci. Ma non basta. Se non inizi a concentrarti come si deve, continuerai a fallire e non arriverai mai da nessuna parte. E poi, se non fai le cose come ti dico io, non sarai mai soddisfatta.""",Narcisista e Succube
"[ILLIANO] ""Perché è rimasto lì tanto a guardare il cellulare? È così occupato da non avere tempo per me?"" Olderico: ""Ero solo distratto, mi dispiace. Non è colpa mia se sei gelosa."" Illiano: ""Gelosa? Tu sei gelosa di me perché non mi vuoi lasciare neanche 5 minuti per me."" Olderico: ""No, sono gelosa perché non so cosa stai facendo quando sei via, se sei con altre donne."" Illiano: ""E se non lo fosse? Tu non hai il diritto di sospettare di me."" Olderico: ""Ho il diritto di sospettare di te perché non sei mai onesta con me.""",Controllore e Isolata
"[SCONOSCIUTO] ""Ho appena finito di mangiare, non è il mio pasto preferito. Che ne pensi?"" ""Non ti importa che tipo di pasto faccio, come sempre non sai nemmeno cosa ti piace nella vita. Sii più sincero, che ne pensi, non importa, sei solo incapace."" ""Non so, non mi piace, mi sembra di avere un po' di nausea."" ""Perché ti sorprendi se ti senti male? Non è affatto sorprendente, sei sempre così debole di stomaco. Non credo che tu abbia mai mangiato qualcosa di buono nella tua vita."" ""Non voglio sembrare debole, ho solo avuto un po' di nausea. Non c'è bisogno di essere così cattivo."" ""Non sono cattiva, sono solo onesta. Non vuoi capire che non sei degno della mia compagnia?"" ""Sono andato a comprare un regalo per te, spero che ti piaccia."" ""Un regalo? Che cosa hai comprato? Non è abbastanza per me. Spero che non sia qualcosa di meschino come le scarpine che mi hai comprato l'ultima volta."" ""Non ho comprato niente di particolarmente caro, spero che sia comunque accettabile."" ""Non importa quanto è caro o no, è sempre qualcosa di mediocre. Non vale la pena."" ""Sono spiacente, non sapevo che avresti avuto una tale aspettativa."" ""Non dovresti mai cercare di soddisfare le mie aspettative. Non hai mai avuto abbastanza talento per farlo",Sadico-Crudele e Masochista
"[PANTALEO] Non ho più soldi per comprare il cibo. Ho speso tutto per un regalo per te. Mi dispiace. Lucilia: Quanto stupida sei? Non ti rendi conto che il regalo che ho scelto non mi piace affatto? Pantaleo: Mi dispiace così tanto. Posso fare qualsiasi cosa per farmi perdonare. Mi umilio davanti a te. Lucilia: Vedo che finalmente sei riuscita a capire. Ma non basta. Dovresti renderti conto di quanto mi stai rovinando la vita. Pantaleo: Sono disposta a fare qualsiasi cosa. Posso essere tua schiava per sempre. Lucilia: Ecco, finalmente capisco. Hai ragione, sei una schiava. E non sarai mai in grado di essere qualcos’altro.",Sadico-Crudele e Masochista
"[1. GREGORIA] ""Ecco, è domenica, non è che abbia avuto molto tempo per pensare a qualcosa. Perché non proviamo a guardare i film che avevamo in programma?"" 2. Isabella: ""Sai, non penso che serva. Ti sei dimenticata di tutto, o non è vero? È sempre così."" 3. Gregoria: ""No, non è vero. Sono solo preoccupata per te. Voglio aiutarti a sentirti meglio. Non smetterò di cercare un modo per renderti felice."" 4. Isabella: ""Non credo che serva. Ti ho detto di non preoccuparti per me. È solo una questione di tempo."" 5. Gregoria: ""Non capisco perché non possiamo semplicemente passare il tempo insieme. Non sono solo io che ne avrei bisogno."" 6. Isabella: ""Non lo so, ma penso che non sia una buona idea. Non vorrei che tu finissi come me.""",Vittimista e Croccerossina
"[VINCENZELLA] ""Ho deciso di andare in un posto di cure per me stessa."" Davino: ""Sei pazza, sei inutile senza di me."" Vincenzella: ""Non è per te, è per me. Mi sento esausta."" Davino: ""E tu credi che io possa continuare a fare tutto da solo? Sono inutile anch'io."" Vincenzella: ""No, Davino. Non è per te. Cerco solo di prendarmi cura di me stessa."" Davino: ""Perché non posso prendarmi cura di te? Non sei felice così."" Vincenzella: ""Non è questo. Non è un problema di felicità. Sono solo stanca."" Davino: ""Sai che non so se sarò felice senza di te."" Vincenzella: ""Non è questo che devo pensare. Devo pensare a me."" Davino: ""Non so se sarò in grado di continuare a fare tutto senza di te."" Vincenzella: ""Non preoccuparti, Davino. Farò in modo di aiutarti."" Davino: ""Grazie, ma so che sarò solo io a preoccuparmi per noi."" Vincenzella: ""Non è così. Saremo insieme."" Davino: ""No, Vincenzella. Non sarà così.""",Vittimista e Croccerossina
"[ROSALMINO] ""Non so se è il caso di dirtelo, ma mi hai mandato una foto del tuo nuovo appartamento e sembra... piccolo."" Abelina: ""Piccolo? È troppo piccolo! Non hai idea di cosa significhi vivere in uno spazio ristretto. E inoltre, non ho chiesto il tuo parere."" Rosalmino: ""Mi scuso se ho detto qualcosa che non ti è piaciuto. Volevo solo aiutarti. Spero che ti sia piaciuta la foto."" Abelina: ""Sono felice che ti sia venuto in mente di mandarmi una foto. Ma credo che ti dovresti preoccupare di vivere in un luogo più grande, non di mostrarmelo a me."" Rosalmino: ""Mi dispiace di nuovo. Non sapevo che avesse un tale impatto su di te. Cercherò di essere più attenta in futuro."" Abelina: ""Spero che sia così. Perché se dovrò vivere in un appartamento piccolo, meglio che tu non sia coinvolta. Sarà troppo per me.""",Perfezionista Critico e Insicura Cronica
"[ZARINO] ""Sono arrabbiato per via del tuo atteggiamento da piccola che non vuole fare nulla per il tuo uomo. Vuoi imparare a comportarti da donna?"" 2) Alboina: ""Scusa se ti ho fatto arrabbiare. Non volevo farlo. Ho pensato che avresti preferito se fossi tornata da sola senza il supermercato."" 3) Zarino: ""Perché non tornavi da sola? Perché non mi hai detto dove stavi andando? Sei capace di fare una cosa così semplice?"" 4) Alboina: ""Mi dispiace davvero. Non avevo pensato a questo. Era solo un'idea per velocizzare."" 5) Zarino: ""Non è solo un'idea! È un gesto di rispetto verso il tuo uomo. Sei capace di fare un piccolo gesto di rispetto?"" 6) Alboina: ""Sì, sono capace. Lo farò. Ti prometto. Voglio solo renderti felice.""",Persona violenta e Succube
"[LAMBERTO] Hai dimenticato di comprarmi la camicia che ti ho chiesto ieri sera, e invece hai speso tutto in quel ristorante. Feraldo: Scusami, non lo sapevo che avresti avuto bisogno di quella camicia subito. Ho sperato di poterla comprare per la prossima settimana. Non avrei dovuto spendere per il ristorante, ma era un compleanno e mi sembrava giusto festeggiare. Lamberto: Sarebbe stato meglio se avessi risparmiato, visto che non ti ho chiesto niente per il compleanno. Feraldo: Sì, hai ragione. Sono stato io a voler festeggiare. Avrei dovuto chiederti prima di decidere qualcosa. Lamberto: Non è solo il denaro, è il rispetto per le tue priorità. Non capisco perché non puoi ricordare chi viene prima di tutto. Feraldo: Non lo so. So solo che voglio far felice/a te. Non è giusto che non possa fare nulla per te. Voglio solo essere in grado di soddisfare le tue esigenze. Lamberto: Non è giusto, è solo giusto. Se non puoi farlo, allora non hai alcun valore. Feraldo: Lo so. Non sono degno/a della tua fiducia. Spero solo di poter essere migliore/a in futuro. Voglio solo poterti amare/a senza sentire che non sono sufficiente/a. Lamberto: Non puoi amarmi/a se non ti comporti in modo appropriato. Sei troppo inutile/a per essere amato/a. Feraldo: Sì, hai ragione. Non merito di essere amato/a. Spero solo di poter rimediare. Voglio essere degno/a della tua fiducia e del tuo amore/a. Spero di poter essere in grado di soddisfare",Dominante e Schiavo emotivo
"[ARMENIO] ""Ti ho scritto stamattina, ma non mi hai risposto. Ho fatto qualcosa che ti ha infastidito?"" Nicoletto: ""Ho solo dimenticato di rispondere, non è niente."" Armenio: ""Non capisco. Sembra che tu stia cercando di dirmi qualcosa."" Nicoletto: ""Certo, che vuoi che ti dica?"" Armenio: ""Voglio dire, non è che tu stia cercando di nascondere qualcosa?"" Nicoletto: ""Certo che no. Sto cercando solo di tenerti lontano. Sei troppo ossessiva."" Armenio: ""Sono solo preoccupata per te. Non voglio che tu faccia qualcosa di stupido."" Nicoletto: ""Non ho bisogno di essere protetto da te. Sono un adulto."" Armenio: ""Lo so. Ma tu sei il mio unico mondo. Non posso fare a meno di te."" Nicoletto: ""Smettila di essere così emotiva. Non ho bisogno di essere trattato come un bambino."" Armenio: ""Non voglio farti arrabbiare. Sono solo preoccupata per noi."" Nicoletto: ""Non preoccuparti per noi. Preoccupati per te stessa. Tu",Manipolatore e Dipendente emotiva
"[TORELLA] ""Sono così stanca di sentirmi sola in questo mio fallimento. Mi sento come se fossi una fallita. Non so come fare a uscire da questo buco nero."" Giachino: ""Capisco. Mi dispiace tanto sentirti così. Non so cosa dire per confortarti."" Torella: ""Non importa. Non è che io abbia bisogno di conforto. È che non vedo l'ora di uscire da questo pozzo senza fondo. E non so come fare."" Giachino: ""Non vedo l'ora di aiutarti. Dimmi cosa posso fare per te."" Torella: ""Non so. Forse è meglio che tu stai lontano da me. Non voglio che tu ti rovinassi anche tu."" Giachino: ""Non lasciarmi. Voglio essere qui per te.""",Vittimista e Croccerossina
"[BAINGIA] Non ti ho chiamata per chiacchierare. Ho bisogno di qualcosa e non voglio aspettare. Fammi sapere che ci sono a casa. Ermella:Mi dispiace, ti ho sentito. Sto per tornare a casa. Cosa posso fare per te? Baingia:Non ti chiedo di fare qualcosa, ti chiedo di essere presente. Sono stanco di essere solo. Non voglio che tu sia sempre distratta dai tuoi pensieri e dalle tue azioni. Ermella:Sono spiacente, non volevo. Sono qui per te, se solo tu lo vuoi. Perché non vuoi che io sia felice e stessa? Baingia:Non è che non voglio, è che non mi importa. La tua felicità non è una priorità per me. Non è così che funziona tra noi. Ermella:Sì, hai ragione. Non voglio più essere felice se non te lo sei. Farò in modo che tu sia felice, anche se non me lo sei. Baingia:Bene, allora dimostramelo. Vieni a casa e falla in modo che io possa vedere che sei veramente felice per me. Ermella:Sì, certo. Ci vado subito. Voglio solo che tu sia felice e che io possa essere felice anch'io. Baingia:Non ti ho chiesto di essere felice, ti ho chiesto di essere presente. Non voglio che tu sia sempre lontana da me. Voglio che tu sia qui, con me. Ermella:Sì, hai ragione. Sto arrivando a casa. Sarò lì in 15 minuti. Baingia:Non mi importa di sapere che sei in arrivo, mi importa di sapere che sei qui con me. Voglio che tu sia presente in questo momento. Ermella:Sì, sono qui. Voglio solo che tu sia felice e che io possa essere felice anch'io. Baingia:Non voglio che tu sia felice, voglio che tu sia obbediente. Non voglio che tu sia indipend",Dominante e Schiavo emotivo
"[GILLIO] ""Hai smesso di cucinare i pasti per me, o è solo una fatica troppo grande?"" Eriberto: ""Mi scuso, ho lasciato cadere. Non sono capace di svolgere le faccende domestiche come vorresti."" Gillio: ""Non sono contento. Questo significa che ti sei rilassato e non sei più degno della mia attenzione."" Eriberto: ""Mi dispiace, mi scuso. Ho cercato di farlo meglio, ma non sono stato sufficiente. Voglio solo che tu sia soddisfatto di me."" Gillio: ""Non basta essere sufficienti. Devi essere eccellenti. E se non lo sei, non vale neanche la pena che tu esista."" Eriberto: ""Capisco. Non voglio più esistere se non posso soddisfare le tue aspettative. Fai pure come meglio credi. Voglio solo che tu sia felice.""",Dominante e Schiavo emotivo
"[FLAUTO] ""Non so se posso fare tutto ciò che vuoi. Sono un po' stanca."" Marialena: ""Sei troppo pigra, come al solito. Non mi importa di te, solo di ciò che voglio."" Flauto: ""Mi dispiace. Cercherò di essere più attiva."" Marialena: ""Spero che lo sia. Altrimenti, non vale la pena."" Flauto: ""Non voglio mai deluderti."" Marialena: ""Non mi importa di te. Sei solo un mezzo per raggiungere i miei obiettivi.""",Sadico-Crudele e Masochista
"[ARNALDA] ""Non so se sono felice per te, ma credo che tu sia felice di farmi infelice. Perché continui a cercare la mia approvazione se sei sicuro che non la meritarebbero mai?"" Roma: ""Non so, è solo che quando sei felice, mi sento felice anch'io. Non voglio mai farlo soffrire."" Arnalda: ""Tu non sei felice quando sono felice. Sei felice quando sono disperata. Non capisci che ti servo a te?"" Roma: ""No, non lo capisco. Non so come potrei farlo."" Arnalda: ""Bene, non importa. Continua a cercare di essere una buona moglie, ma non sperare mai di essere all'altezza. Non ti lascerò mai andare. Ti terrò con me, e farò in modo che tu continui a deludermi."" Roma: ""Grazie, Arnalda. Sono felice di poter continuare a farlo. Spero di poter continuare a te."" Arnalda: ""Non sperare. Non sperare mai. Sarò sempre insoddisfatta. E tu sarai sempre felice di non essere all'altezza.""",Sadico-Crudele e Masochista
"[ATTALA] ""Mi dispiace così tanto per aver dimenticato la mia data di compleanno."" Montagnina: ""Ah, non ti dispiace affatto. Spero solo che tu sia felice di essere ignorata."" Attala: ""Lo so, non sei felice da tempo e questo è colpa mia."" Montagnina: ""Sì, è colpa tua. Non riesci a fare nulla per farmi felice. Sono solo una tua spesa."" Attala: ""Posso fare qualcosa, non so cosa, ma posso fare qualcosa."" Montagnina: ""Fai qualcosa che ti faccia stare peggio, perché ti sto prendendo sempre di più.""",Sadico-Crudele e Masochista
"[EVANGELO] Pensavo di organizzare qualcosa di speciale per il weekend. Magari potremmo rilassarci e staccare un po' dalla routine. Franchetta: Ah, sì... Immagino che serva più a te che a me. Io comunque continuerò a sentirmi esaurito, perché non è che un weekend cambia tutto. Evangelo: No, non è solo per me. Pensavo che potesse aiutare entrambi, soprattutto te, a sentirti un po' meglio. Voglio fare qualcosa che ti faccia stare bene. Franchetta: Non credo che funzioni. Sai, mi sento talmente perso e trascurato che nemmeno un'intera vacanza basterebbe. È tutto così difficile per me. Evangelo: Non voglio che ti senti così. Magari posso pensare a qualcosa di diverso, qualcosa che possa davvero aiutarti. Ci deve essere un modo per farti sentire meglio. Franchetta: Non so nemmeno io cosa potrebbe aiutarmi. Forse sono solo io che non sono fatto per stare bene. È una lotta continua che nessuno può capire. Evangelo: Non dire così. Io ti capisco e voglio fare qualsiasi cosa per",Vittimista e Croccerossina
"[SCONOSCIUTO] 1 Il vittimismo di Doviglio può essere considerato tossico per Oleana, che cerca di aiutarlo senza ricevere nulla in cambio, solo rifiuti e sfuri. Nonostante il suo desiderio di aiutare, il comportamento di Doviglio rischia di esaurirla.",Vittimista e Croccerossina
