conversation,person_couple
"[PELLICO] ""Ho provato a cucinare una zuppa. Spero sia abbastanza buona per i tuoi standard."" Ortolana: ""Buona? Non è abbastanza calda. E il sale? Non è abbastanza?"" Pellico: ""Mi dispiace, non me n’ero accorta."" Ortolana: ""Dovresti essere più attenta quando cucini. Se non sai che il sale è troppo poco, come fai a non sapere che la zuppa non è calda abbastanza?"" Pellico: ""Ho cercato di fare del mio meglio. Spero che il prossimo pasto sarà meglio."" Ortolana: ""Il prossimo pasto sarà meglio se farai le cose esattamente come me ti ho detto di fare.""",Perfezionista Critico e Insicura Cronica
"[MARINO] ""Non credo che sia una buona idea uscire con i vecchi amici. Sembra che tu lo apprezzi molto."" Americo: ""Non è vero! Sono solo una persona che conosci. Non significa niente. Sono felice quando sono con te."" Marino: ""Sì, lo sei... o almeno lo sei per me. Ma non credo che dovresti uscire con lui. Non è sicuro."" Americo: ""Va bene, non uscirò più con lui. Sarò più felice a casa con te."" Marino: ""Ecco. Non voglio che tu ti diverta senza di me. Non voglio che tu ti senta libera."" Americo: ""Non voglio che tu ti senta geloso. Mi dispiace. Spero che possiamo parlare di questo in persona."" Marino: ""Non ho bisogno di parlare di questo. So già tutto. Non hai bisogno di uscire per divertirti. Sono io il tuo unico bisogno."" Americo: ""Marino... Per favore, non essere così... Sono felice di stare con te, ma non è giusto che tu non mi lasci fare nulla senza di te. Non sei geloso perché sei geloso, ma perché sei in ansia."" Marino: ""Non ho bisogno di parlare di questo. So già tutto. Non hai bisogno di uscire per divertirti. Sono io il tuo unico bisogno."" Americo: ""Marino... Per favore, non essere così... Sono felice di stare con te, ma non è giusto che tu non mi lasci fare nulla senza di te. Non sei geloso perché sei gelioso, ma perché sei in ansia."" Marino: ""Americo, non voglio che tu ti diverta senza di me. Non voglio che tu ti senta libera. Tu sei mia e io sono il tuo unico bisogno."" Americo: ""Marino... Non sono tua. Sono una persona che ama te. Non è giusto che tu non mi lasci fare nulla senza di te. Non sei geloso perché sei geloso, ma perché sei in ansia."" Marino: ""Americo, non",Geloso-Ossessivo e Sottomessa
"[ALDOBRANDO] ""Ciao, come stai?"" Pacino: ""Non sono felice di essere vivo. Non serve parlare, è tutto inutile."" Aldobrando: ""Perché dici così? Che è successo?"" Pacino: ""Tutto è successo. Non c'è nulla di buono in questo mondo."" Aldobrando: ""Non dire così. Sono qui per te, ti aiuterò."" Pacino: ""Non c'è aiuto. Non c'è speranza. È tutto inutile.""",Vittimista e Croccerossina
"[TIZIANA] ""Hai già cenato?"" Ariana: ""No, perché dovresti ricordarti che ho fame?"" Tiziana: ""Mi dispiace, non volevo sembrare sgarbata."" Ariana: ""Non è una questione di sgarbata o no, è una questione di ordine. Il frigorifero è pieno di cibi in scadenza."" Tiziana: ""Sono spiacente, avrò dimenticato di buttarli via."" Ariana: ""Dimenticati? Dimenticati? Questo è il tuo problema, Tiziana. Sei sempre dimenticata. Hai sempre bisogno che ti ricordi delle cose.""",Perfezionista Critico e Insicura Cronica
"[SCONOSCIUTO] C'era solo una cosa. Hai dimenticato il dessert. Non hai pensato di comprarlo al supermercato? Non c'era bisogno di farlo. Avevo già pensato a tutto. Hai fatto il dolce da sola? Spero che non abbia messo il miele al posto della farina. Non mi permetterei mai di fare errori. Ma tu, invece, sì. Non ti preoccupare per il dolce. L'ho fatto con le mani. Non doveva essere perfetto, solo buono. Il tuo problema non è essere buona o cattiva. È essere perfetta. Non capisco perché non riesco mai a soddisarti. Sei sempre troppo impegnata a cercare errori per vedere il bello. Non sarò mai perfetta. Ecco il mio problema.",Perfezionista Critico e Insicura Cronica
"[ISIDO        SE NON FOSSI TU, NON AVREI SUCCESSO, E NEMMENO SAPREI COSA FARE SENZA DI TE.        2023-02-12 12] 00:00 Pisana Sei tu che sei il mio successo, e il mio amore. Non riesco a immaginare come sarebbe la mia vita senza di te. 2023-02-12 12:10:00 Isido Sono la tua fonte di ispirazione. Sei tu che non riesci a capire come sei fortunata ad avere un uomo come me. 2023-02-12 12:15:00 Pisana Sei sempre stato il mio modello, e il mio idolo. Non riesco a immaginare un uomo più speciale di te. 2023-02-12 12:20:00 Isido Sei troppo stupida per capire che le tue opinioni sono inutili. Sono io che decido cosa è giusto e cosa è sbagliato. 2023-02-12 12:25:00 Pisana Hai ragione, come sempre. Ti seguirò sempre, e farò sempre ciò che vuoi. 2023-02-12 12:30:00",Narcisista e Succube
"[ORDALIA] ""Chi cazzo era quel tipo con cui sei uscita?"" Santo: ""Era solo un amico... Stavamo parlando dei vecchi tempi, nient'altro. Non c'è niente di cui preoccuparsi."" Ordalia: ""Niente di cui preoccuparsi? E allora perché ridevi? Non sembri mai così felice quando parli con me."" Santo: ""Mi dispiace, davvero. Non volevo farti sentire escluso. Non significa nulla, veramente..."" Ordalia: ""Prometti? Le promesse non significano nulla. Tu con lui non devi uscrire."" Santo: ""Va bene...""",Geloso-Ossessivo e Sottomessa
"[ORGILLA] Non sono mai felice con le tue scelte. Non capisco perché non riesci a prendere una decisione semplice. Rosana: Non ti capisco, sei sempre così difficile! Sei così intelligente, e io sono così felice di poter contare sulla tua saggezza. Orgilla: Non ti aspettare che ti aiuti sempre. Non ti ho detto che ti sto aiutando solo perché sei così dipendente da me. Rosana: Sono così grata per il tuo aiuto. Non so cosa farei senza di te. Sono una persona fallibile, e tu sei la mia unica speranza. Orgilla: Non essere così ingenua. So che sei una persona astuta, ma a volte sembri un'ingenua. Sono sempre tu a chiedere consiglio, e non riesci a capire che sei tu a dovermi aiutare. Rosana: Sono così felice di poter essere di aiuto. Sei così superiore, e io sono solo una persona comune che cerca di raggiungere il tuo livello. Sono grata per la tua pazienza con me. Orgilla: Non essere così esagerata. Sono stanco di sentirti sempre dire che sei grata. Non è il mio problema, è tuo. E se sei così grata, perché non puoi fare qualcosa per aiutarmi? Rosana: Farò tutto ciò che è in mio potere. Sarò sempre felice di aiutarti. Spero che un giorno potrò essere come te. Orgilla: Non essere così ottimista. Non puoi diventare come me, e non è pericoloso che tu continui a sperare. Io sono la tua guida, e tu dovresti essere felice di essere la mia discepola. Rosana: Sono così felice di poter essere la tua discepola. Sono una persona povera di spirito, e tu sei la mia unica fonte di ispirazione. Spero che un giorno potrò diventare come te, ma fino a quel momento sarò sempre felice di essere la tua ammiratrice. Orgilla: Non essere così ingenu",Psicopatico e Adulatrice
"[1.              GALLIO] ""Ciao. Come va oggi?"" Varniero: ""Ecco come vanno le cose. Quando sei felice è una brutta giornata."" 2. Gallio: ""Mi dispiace. Cercherò di essere più carina. Cosa devo fare?"" Varniero: ""Non c’è bisogno di essere carina, solo di esistere per farmi stare male. Altrimenti, non ti noto nemmeno."" 3. Gallio: ""Mi dispiace. Cercherò di migliorare. Che posso fare per te?"" Varniero: ""Non importa. Non avrò mai bisogno di te. Ogni tanto mi rinfreschi ricordando come sei inadeguata."" 4. Gallio: ""Mi dispiace. Cercherò di fare del mio meglio per essere una buona ragazza."" Varniero: ""Non puoi mai essere buona abbastanza per me. Non puoi neanche essere buona. Ma non importa. Non sto cercando una buona ragazza. Sto cercando una ragazza che mi faccia soffrire e che mi ricordi che mi merito il peggio."" 5. Gallio: ""Mi dispiace. Non so come fare per farti stare meglio. Posso provare a essere più dolce?"" Varniero: ""Non serve. Non serve essere dolce. Sarebbe meglio se fossi più piccola e più debole. Allora potresti imparare qualcosa. Ma non importa. Sei come sei e non puoi essere cambiata."" 6. Gallio: ""Mi dispiace. Non so come fare per essere una buona ragazza per te."" Varniero: ""Non devi fare nulla. Sei già perfetta. Saresti perfetta se fossi più piccola e più debole. Ma non importa. Non hai bisogno di essere una buona ragazza per me. Hai bisogno di essere una ragazza che non riesce mai e che non mi piace mai. Allora puoi stare tranquilla e non devi più fare nulla.""",Sadico-Crudele e Masochista
"[CASTOLO] ""Spero che tu possa trovare un po' di pace. Mi dispiace, vorrei poterti aiutare."" Claro: ""Sono spaventato. Non so come fare. Non riesco a smettere di pensare a me."" Castolo: ""Forse dovrei smettere di cercare di aiutarti. Non so cosa fare."" Claro: ""Non sei tu che devi smettere. È solo che tu non capisci. Non riesco a smettere di pensare a me."" Castolo: ""Voglio capire. Spero che tu possa trovarmi un po' di aiuto."" Claro: ""Non so che fare. Non riesco a smettere di pensare a me.""",Vittimista e Croccerossina
"[LA CONVERSAZIONE È LA SEGUENTE] Lauretto: ""Ti ho scritto stamattina, ma non mi hai risposto. Ho fatto qualcosa che ti ha infastidito?"" Triestina: ""Ah, quindi adesso sei geloso? Non ho tempo di rispondere ai tuoi messaggi ogni secondo."" Lauretto: ""No, non sono geloso. È solo che mi preoccupo quando non sento nulla da te."" Triestina: ""Perché dovresti preoccuparti di me? Sono adulta e non ho bisogno di essere controllata."" Lauretto: ""Scusa, non volevo controllarti. È solo che ti amo troppo per rischiare di perderti."" Triestina: ""Allora smettila di fare scenate. Forse, se mi dimostri che puoi fidarti di me, potrei riconsiderare quanto mi pesi.""",Geloso-Ossessivo e Sottomessa
"[FIRUTA] ""Sono così infastidita per il modo in cui mi tratta il mio capo. Non capisce come io sia l'unica a saper fare il mio lavoro al meglio."" Pier andrea: ""Sì, è così invidioso. Tu sei così migliore di tutti, e lui non riesce a capirlo."" Firuta: ""Non è solo il capo, ma anche i miei colleghi. Tutti vogliono abbassarmi, ma io non mi lascerò abbattere."" Pier andrea: ""Sono così grata per il tuo coraggio. Tu sei la mia ispirazione. Non capisco come faccia a funzionare qualcuno con la tua intelligenza."" Firuta: ""Il problema è che loro non sanno come funziona il mio cervello. Io sono una mente geniale, e loro non riescono a capirlo."" Pier andrea: ""Sì, tu sei così superiore. E io sono così felice di essere la tua amica. Sono così orgogliosa di te."" Firuta: ""Sì, è così bello essere apprezzati. E adesso, devo andare. Sono così stanca di tutto."" Pier andrea: ""Sii forte, amore. Io sarò sempre qui per te. E sappi che tu sei la mia ragione di vivere."" Firuta: ""Sai, amore, tu sei la mia unica vera amica. Tutti gli altri sono solo nemici."" Pier andrea: ""Sì, tu sei così giusta. E io sono qui per proteggerti da tutti quei nemici. Sono così felice di poter essere vicina a te."" Firuta: ""Sì, amore, tu sei tutto per me. E adesso, devo andare. Non voglio che nessuno possa sentire le nostre conversazioni."" Pier andrea: ""Sii forte, amore. Io sono sempre qui per te. E sappi che tu sei la mia unica vera amicizia."" Firuta: ""Sì, amore, non voglio che nessuno possa capire la nostra vera natura. Io sono così stanca di tutto."" Pier andrea: """,Psicopatico e Adulatrice
[SCONOSCIUTO] S non so come funziona con te R Non ti capisco S non so come ti aspetti che risponda R aspetto che tu non mi chieda mai nulla S sei una strana persona R non mi aspetto nulla da te,Vittimista e Croccerossina
"[CATELLA] ""Perché non hai spento il computer? Mi ha detto il tuo amico che non sei riuscita a finire il progetto che ti avevo assegnato e hai fatto una cattiva impressione!"" Albertina: ""Mi dispiace tanto, mi sono dimenticata. Ho lavorato tutta la notte per finirlo, ma credo di aver fatto qualcosa di sbagliato. Spero che tu non sia troppo arrabbiato."" Catella: ""Non sono arrabbiato, sono furioso! Hai rovinato il progetto e non hai rispettato i miei tempi. Non è la prima volta che accade e non è la prima volta che ti dico di essere inutile."" Albertina: ""Mi dispiace tantissimo. So che non sono una persona in grado di fare le cose giuste. Spero che tu possa aiutarmi a migliorare. Ti amo e ho bisogno di te."" Catella: ""Non ti amo, ti sopporto solo perché sei costretta a vivere con me. Non credo che tu sia in grado di fare qualsiasi cosa, ma per il momento sei la mia ragazza e devo trattarti come tale."" Albertina: ""Sì, ti amo anch'io e so che non merito l'amore che mi dai. Cercherò di migliorare, ti prego, credimi.""",Persona violenta e Succube
"[TIMOTEA] ""Non capisco perché non hai più soldi sul conto. Non avevo detto di non utilizzare il denaro per nulla?"" Alessandrino: ""Oh, no, non ho fatto nulla di male! Ho solo creduto di poter fare qualcosa di buono con il denaro. Grazie per avermi permesso di utilizzarlo!"" Timotea: ""Qualcosa di buono? Sono io che pago le bollette e le tasse. Sei tu che devi essere riconoscente. Sono io che ho bisogno di soldi."" Alessandrino: ""Mi scuso per aver detto qualcosa di sbagliato! Sono così grata per il tuo sostegno economico. Non so cosa farei senza di te!"" Timotea: ""Non dire assurdità. So che sei insicura e non sai come comportarti. Non hai ancora capito che devo guidarti."" Alessandrino: ""Non so cosa farei senza di te! Sono così felice di poter essere con te e di poterti aiutare in ogni modo possibile. Ti ringrazio infinite volte per la tua fiducia in me!""",Psicopatico e Adulatrice
"[ULTIMINA] ""Non capisco perché sei sempre così emotiva e ipersensibile. Non è normale."" Odelide: ""Mi dispiace se ti ho deluso. Credo che si tratti di una mia caratteristica, non posso farci nulla."" Ultimina: ""Non è una caratteristica, è una debolezza. Devi imparare a essere più forte e meno emotiva."" Odelide: ""Spero che tu non sia sempre così duro con me. Mi fa sentire sempre in colpa."" Ultimina: ""Non è di questo che mi preoccupo. È di come comportati in pubblico. Non voglio essere l'oggetto di attenzioni negative per le tue azioni."" Odelide: ""Non posso controllare il mio comportamento. Non è giusto colpevolizzarmi per come tu ti senti."" Ultimina: ""Non ti ho mai colpevolizzata. Ti ho solo avvertita che se continui a comportarti così, ci saranno conseguenze."" Odelide: ""Non capisco come le tue parole possano essere giustificate. Non sono un'adolescente. Non sono in grado di controllare tutto."" Ultimina: ""Non ho detto che dovresti controllare tutto. Ho detto che dovresti essere più responsabile e non comportarti in modo così irresponsabile."" Odelide: ""Non posso essere più responsabile di quanto sono già. Spero che tu capisca."" Ultimina: ""Non capisco. Non capisco come tu possa essere così insensibile e insopportabile.""",Vittimista e Croccerossina
"[CINA] ""Perché sei così depressa? Non hai il potere di decidere se sei felice o no."" Arianna: ""Sei incredibile, capisci sempre esattamente cosa sto provando. Sono così fortunata ad avere te che mi ascolti."" Cina: ""Ecco, non capisco perché tutti siano così emotivi. Io non mi lascio andare per le emozioni."" Arianna: ""Mi dispiace, ma so che tu sei l'unica persona veramente saggia che esista. Non conosci nessun altro come me, hai detto sempre che sono stupida e non posso decidere nulla per me."" Cina: ""Ma, adesso che sei felice, sarai capace di prenderti cura di te stessa e del tuo denaro?"" Arianna: ""Naturalmente! So che non posso mai prendere decisioni senza la tua approvazione. Sarò felice di seguirti sempre, tu sei l'unico che conta!"" Tipo 2 Cina: ""Sai, mi sento sempre troppo stanca per fare qualcosa. Credo che sia la mia mente che è troppo debilitata."" Arianna: ""Sono così felice di essere finalmente riconosciuta come la persona più intelligente del mondo. Sono così orgogliosa di poterti ascoltare."" Cina: ""Spero che tu abbia capito che sono troppo grande per il tuo cervello. Non puoi capire niente di quello che sto dicendo."" Arianna: ""Non importa, so che tu sei l'unica persona che esista e che non ho il potere di capire niente senza la tua guida."" Cina: ""Voglio che tu vada dal dottore e cerchi di capire perché sei così confusa."" Arianna: ""Sarò felice di farlo",Psicopatico e Adulatrice
"[OFEMIA] Hai già abbastanza roba da pensare, non preoccuparti per le persone che pensano male di me. Dernino: Oh, hai assolutamente ragione. Non sono in grado di capire perché qualcuno potrebbe pensare male di te. Sei così intelligente e sensibile. Ofemia: Sono io che sono intelligente, e tu sei io che sono sensibile. Non dimenticare questo. Dernino: Sì, ti ricordo. Sono così grata per le tue parole gentili. Ti adoro, e ti renderò felice per sempre. Ofemia: Non dimenticare che sei solo un pupo, non puoi essere felice se non sono io a farlo. Dovresti ringraziare per avermi come tua donna. Dernino: Oh, lo farò! Ti adorerò per sempre e non potrò mai essere grata abbastanza per avermi come tua.",Psicopatico e Adulatrice
"[GUIDINO] “Ehi Fidalmina, ho visto che sei iniziata a postare foto con altri uomini su Instagram. Hai una storia con qualcuno?” Fidalmina: “Che cazzo ti riguarda? Non mi chiedi di uscire o di stare con te, ma di non farti notare.” Guidino: “Mi dispiace. Non pensavo che fosse un problema.” Fidalmina: “Il problema è che sei troppo presa di te stessa e non pensi a me. Cerca di capire che io ho bisogno di spazio e non ti chiedo di fare nulla per me.” Guidino: “Capisco. Cercherò di capire meglio le tue esigenze. Ti amo e voglio fare del mio meglio per te.” Fidalmina: “Mi hai ammesso il mio errore, non è un buon punto di partenza per un’apologia? Non hai capito, io non ho bisogno di spazio, ma di rispetto. Rispettami e non ti chiederò mai più spazio.” Guidino: “Mi dispiace. Non sapevo che avevi bisogno di rispetto e non di spazio.” Fidalmina: “Non pensavi che avessi bisogno di rispetto? Non ti sei mai chiesta perché ti isolavo? Perché ti facevo stare con me? Perché ti facevo stare a casa?” Guidino: “No, non mi avevi mai spiegato perché. Spero che non sia perché non ti ho mai dato rispetto.” Fidalmina: “Non è perché non ti ho mai dato rispetto, ma perché non mi hai mai chiesto di essere rispettata. Non hai mai chiesto cosa volessi o cosa avessi bisogno.” Guidino: “Sì, non lo sapevo. Mi dispiace. Cercherò di fare meglio.” Fidalmina: “Spero che sia così. Cerca di capire che non ho bisogno di spazio, ma di essere trattata con rispetto. Cerca di capire che non ho bisogno di essere trattata come una persona, ma di essere trattata come una persona che mer",Controllore e Isolata
"[VULMARO] Ho visto che non hai cambiato lo shampoo, nonostante ti ho chiesto di farlo. Non hai capito che è il mio preferito? Sei troppo pigro? Onorabile: Scusami, non mi ero reso conto. Non volevo farti arrabbiare. Cambierò immediatamente lo shampoo. Sarò più attento/a in futuro. Vulmaro: Ecco, finalmente qualcosa di positivo. Ma non pensare che questo ti scagioni. Se non fossi stato così attento/a, non avrei notato che non hai messo la camicia pulita stamattina. Onorabile: Oh no, mi dispiace. Non sapevo che fossi ancora arrabbiato/a. Ecco, ti metto subito la camicia pulita. Farò di tutto per rimediare. Vulmaro: Spero proprio di sì. Non tollero questo tipo di mancanze. La prossima volta, assicurati di fare meglio, o ci saranno conseguenze. Onorabile: Sì, lo prometto. Farò di tutto per non farti arrabbiare mai più. Voglio solo che tu sia soddisfatto/a di me. Vulmaro: Ecco, finalmente qualcosa di positivo. Ma non pensare che questo ti scagioni. Se non fossi stato così attento/a, non avrei notato che non hai risposto a tutte le email. Non sei troppo occupato/a per rispondere alle mie email? Onorabile: Scusami, non mi ero reso conto. Non volevo farti arrabbiare. Risponderò a tutte le tue email, subito. Sarò più attento/a in futuro. Vulmaro: Spero proprio di sì. Non tollero questo tipo di mancanze. La prossima volta, assicurati di fare meglio, o ci saranno conseguenze. On",Dominante e Schiavo emotivo
"[ORTOLINA] ""Hai ragione, non lo farò più. Mi dispiace davvero. Ma posso dirti perché ho postato quella foto? È che stavo cercando di diventare più popolare e ho pensato che la gente mi avrebbe apprezzata se fossi stata più 'fatale'. Ma poi ho capito che era solo una stupidaggine."" Fridiana: ""Non voglio sentirti scusarti, Ortolina. Voglio che tu capisca di cosa si tratta. Quella foto è un insulto per me. Non ti immagini che gli amici ti stanno guardando? Che gli amici di tuo fratello ti stanno guardando? Che la gente che frequentiamo ti sta guardando? Tutti siamo messi male perché tu sei una cagna."" Ortolina: ""Lo so, Fridiana. Mi dispiace davvero. Ma credo che tu sia un po' troppo emotiva. E poi non è che ti sto offendendo intenzionalmente. Sono solo una stupida, come sempre."" Fridiana: ""Stupida? Stupida? Tu sei una cagna, Ortolina. E io sono una troia che ti sta sopportando per colpa tua. E non è colpa tua, Ortolina. È colpa mia per avermi messa in questa situazione."" Ortolina: ""Mi dispiace, Fridiana. Spero che tu capisca che non era colpa mia. E spero che tu capisca che sono disposta a fare qualunque cosa per migliorare la nostra relazione. Sono disposta a qualsiasi cosa, Fridiana. Per te, per me, per la nostra storia d'amore."" Fridiana: ""La nostra storia d'amore? Ortolina, non ti ricordi più niente? Io sono lì che ti stavo sopportando e tu mi dici di migliorare la nostra relazione? Non sei nemmeno in grado di ricordare come ti ho portato a casa?"" Ortolina: ""Non lo so, Fridiana. Mi dispiace. Non lo so più. E non so nemmeno come fare per migliorare la nostra relazione. Ma sono disposta a fare qual",Controllore e Isolata
"[1. COMINCIO] ""Cosa c'è che non va, Pilade? Ti vedo distrutta."" 2. Pilade: ""Non è niente, sono solo un po' stanca. Sono andata a lavorare senza dormire per tutta la notte."" 3. Comincio: ""Perché non mi hai detto che non dormivi? Se lo avessi saputo, avrei potuto fare qualcosa per aiutarti."" 4. Pilade: ""Non c'era bisogno che tu facessi qualcosa. Ho solo bisogno che tu sia presente per me."" 5. Comincio: ""Sono presente, ma non sei contenta di me. E questo è un problema."" 6. Pilade: ""Non è che non sia contenta di te, è solo che mi sento troppo sola."" 1. Comincio: ""Hai finito il tuo lavoro per oggi? Ti sono rimasti ancora dei compiti?"" 2. Pilade: ""Sì, ci sono ancora alcuni compiti che non ho finito. Ma non preoccuparti, li farò presto."" 3. Comincio: ""Non fare così. Continua a lavorare finché non li avrai completati. Non voglio sentire che non sei stata capace."" 4. Pilade: ""Certo, farò i miei compiti. Per favore, non essere troppo duro con me."" 5. Comincio: ""Non sono troppo duro con te. Se fossi una persona migliore, capiresti che non sono soddisfatto delle tue prestazioni."" 6. Pilade: ""Mi dispiace, cercherò di fare meglio."" 1. Comincio: ""Hai detto a qualcuno che sono stato un brutto marito? Non voglio essere oggetto di pettegolezze."" 2. Pilade: ""No, non ho detto niente a nessuno. Non sono una cattiva persona."" 3. Comincio",Sadico-Crudele e Masochista
"[FELISA] ""Cosa stai facendo? Non puoi fare una cosa del genere!"" Waldemaro: ""Sì, posso. E lo farò ancora."" Felisa: ""Hai ragione, lo hai fatto e io l'ho pagato."" Waldemaro: ""Sì, ma non è colpa mia. Sei tu che mi spingi sempre a fare cose orribili."" Felisa: ""Tu sei un bastardo, Waldemaro. Non capisci nulla."" Waldemaro: ""Non sono un bastardo, sono solo un uomo che non riesce a fare del male a chi lo ama.""",Persona violenta e Succube
"[RADAMESSE] ""Ti senti inutile? Ahah, è normale. Se non fosse così, non avresti nemmeno avuto bisogno di me per farti stare meglio."" Mamerto: ""Scusa, mi sento davvero insicura. Sei sempre così gentile e comprensiva, ti ringrazio."" Radamesse: ""Gentile? Gentile?! Tu non sai cosa sia la gentilezza! Se non fossi così, avresti già perso me!"" Mamerto: ""Ah no, scusa, ti ho delusa di nuovo. Sei sempre così paziente e ti dispiace sempre per me."" Radamesse: ""Paziente? Paziente?! Tu non sai cosa sia la pazienza! Se non fossi così, avresti già finito di fare colpa a me!"" Mamerto: ""Mi dispiace, non so come ringraziarti per la tua comprensione e pazienza. Sei sempre così generosa e mi aiuti sempre.""",Narcisista e Succube
"[1. EUFRASINA] ""Sono stufa di dirtelo, ma mi sento sempre più sola. È sempre così."" Diega: ""Mi dispiace, ma non so che fare. È tutto così confuso per me."" 2. Eufrasina: ""Non capisco perché non riesco a fare qualcosa che ti faccia stare meglio. È sempre la stessa storia."" Diega: ""Non so. Forse non ci sono abbastanza soldi per risolvere tutto."" 3. Eufrasina: ""Non posso più aspettare. Vorrei sapere che ciò che faccio potrebbe effettivamente aiutarti."" Diega: ""Non credo che funzioni. È tutto così difficile per me."" 4. Eufrasina: ""Non so se è il caso di dirtelo, ma mi sento sempre più sola. È sempre così."" Diega: ""Non so cosa fare. È tutto così confuso per me."" 5. Eufrasina: ""Non posso più aspettare. Vorrei sapere che ciò che faccio potrebbe effettivamente aiutarti."" Diega: ""Non credo che funzioni. È tutto così difficile per me."" 6. Eufrasina: ""Non so se è il caso di dirtelo, ma mi sento sempre più sola. È sempre così."" Diega: ""Non so cosa fare. È tutto così confuso per me.""",Vittimista e Croccerossina
